{
  "id": "sqrt2-irrational",
  "order": 3,
  "domain": "수 체계 및 정수론",
  "titleKo": "√2의 무리수성 증명 (Irrationality of √2)",
  "titleEn": "Irrationality of Square Root of 2",
  "statement": {
    "typesetMath": "\\sqrt{2} \\notin \\mathbb{Q}",
    "explanationKo": "2의 제곱근은 유리수가 아니며, 기약분수 형태로 나타낼 수 없는 무리수이다.",
    "explanationEn": "The square root of 2 is an irrational number and cannot be expressed as a ratio of two integers."
  },
  "historicalSignificance": "고대 피타고라스 학파의 히파소스(Hippasus)가 발견한 수학사 최초의 무리수 존재 증명으로, 모든 양은 정수의 비로 표현된다는 피타고라스 우주관을 뒤흔든 제1차 수학 기초론 위기의 발단.",
  "prerequisites": [
    "유리수의 정의 (두 정수의 기약분수)",
    "정수의 홀짝성 (偶奇性)"
  ],
  "intuitiveIdea": "루트 2를 서로소인 기약분수 p/q로 놓으면 2q^2 = p^2이 되어 p가 짝수여야 하고, p를 2k로 치환하면 q 역시 짝수가 되어 처음 가정한 기약분수(서로소) 조건에 모순이 발생함.",
  "rigorousProof": {
    "proofType": "기약분수 귀류법 (Proof by Contradiction via Coprime Fractions)",
    "assumptions": [
      "√2가 유리수라고 가정하자: √2 = p/q (단, p, q는 서로소인 자연수, gcd(p, q) = 1)"
    ],
    "steps": [
      {
        "stepNumber": 1,
        "title": "유리수 가정 및 양변 제곱",
        "explanation": "가정에 따라 양변을 제곱하여 분모 $q^2$를 곱한다.",
        "typesetMath": "\\sqrt{2} = \\frac{p}{q} \\implies 2 = \\frac{p^2}{q^2} \\implies p^2 = 2q^2",
        "justification": "등식의 양변 제곱 및 정수 정돈"
      },
      {
        "stepNumber": 2,
        "title": "p의 짝수성 규명",
        "explanation": "$p^2 = 2q^2$이므로 $p^2$은 2의 배수(짝수)이다. 정수의 제곱이 짝수이면 원래 정수도 짝수이어야 하므로 $p$는 짝수이다.",
        "typesetMath": "p^2 \\equiv 0 \\pmod 2 \\implies p = 2k \\quad (k \\in \\mathbb{Z})",
        "justification": "홀수의 제곱은 홀수이므로 대우명제에 의해 짝수의 성질 성립"
      },
      {
        "stepNumber": 3,
        "title": "p 대입 및 q^2 표현",
        "explanation": "$p = 2k$를 원래 식 $p^2 = 2q^2$에 대입한다.",
        "typesetMath": "(2k)^2 = 2q^2 \\implies 4k^2 = 2q^2 \\implies q^2 = 2k^2",
        "justification": "대수적 치환 및 양변을 2로 나눔"
      },
      {
        "stepNumber": 4,
        "title": "q의 짝수성 규명",
        "explanation": "$q^2 = 2k^2$이므로 동일한 논리에 의해 $q^2$도 짝수이며, 따라서 $q$ 역시 짝수이다.",
        "typesetMath": "q^2 \\equiv 0 \\pmod 2 \\implies q \\text{ is even} \\implies 2 \\mid q",
        "justification": "짝수의 정의"
      },
      {
        "stepNumber": 5,
        "title": "기약분수 조건과의 모순 도출",
        "explanation": "$p$와 $q$가 둘 다 짝수이므로 2를 공약수로 갖는다. 이는 최초의 가정 $\\gcd(p, q) = 1$ (서로소)과 모순이다.",
        "typesetMath": "2 \\mid p \\land 2 \\mid q \\implies \\gcd(p, q) \\ge 2 \\quad (\\text{Contradiction with } \\gcd(p,q)=1)",
        "justification": "기약분수 공리의 위배"
      }
    ],
    "conclusion": "따라서 $\\sqrt{2}$를 분수로 나타낼 수 없으므로 무리수이다 (Q.E.D.)."
  },
  "corollariesAndApplications": [
    {
      "title": "실수 체계의 완비성",
      "typesetMath": "\\mathbb{R} = \\mathbb{Q} \\cup \\mathbb{I}",
      "description": "유리수 집합의 조밀성 구멍을 메우는 데데킨트 절단과 완비 순서체 이론의 발전 촉발"
    }
  ]
}