{
  "id": "central-limit",
  "order": 7,
  "domain": "확률 및 통계학",
  "titleKo": "중심극한정리 (Central Limit Theorem)",
  "titleEn": "Central Limit Theorem (CLT)",
  "statement": {
    "typesetMath": "Z_n = \\frac{\\bar{X}_n - \\mu}{\\sigma / \\sqrt{n}} \\xrightarrow{d} \\mathcal{N}(0, 1)",
    "explanationKo": "모집단의 분포가 무엇이든 평균과 분산이 유한하다면, 표본의 크기 n이 충분히 커질 때 표본평균의 표준화 분포는 표준정규분포로 수렴한다.",
    "explanationEn": "The normalized sum of independent and identically distributed random variables converges in distribution to a standard normal distribution."
  },
  "historicalSignificance": "자연계와 사회현상에서 가우스 정규분포가 보편적으로 나타나는 수학적 이유를 규명한 현대 추측통계학의 절대적 초석.",
  "prerequisites": [
    "독립동일분포 (i.i.d.)",
    "적률생성함수 (MGF)",
    "테일러 급수와 분포수렴"
  ],
  "intuitiveIdea": "표본평균의 적률생성함수(MGF)를 테일러 전개하면 n이 무한대로 갈 때 고차 모멘트 항들이 모두 소멸하고 오직 2차 모멘트 항만 남아 e^(t^2/2), 즉 표준정규분포의 MGF와 완전히 일치하게 됨.",
  "rigorousProof": {
    "proofType": "적률생성함수(MGF) 급수 전개 증명 (Moment Generating Function Proof)",
    "assumptions": [
      "i.i.d. 확률변수 X_1, ..., X_n (평균 mu, 분산 sigma^2 < inf)",
      "표준화 변수 Y_i = (X_i - mu)/sigma"
    ],
    "steps": [
      {
        "stepNumber": 1,
        "title": "표준화 합 변수의 정의",
        "explanation": "$E[Y_i] = 0, \\operatorname{Var}(Y_i) = 1$인 $Y_i$에 대해 $Z_n = \\frac{1}{\\sqrt{n}} \\sum_{i=1}^n Y_i$로 둔다.",
        "typesetMath": "Z_n = \\sum_{i=1}^n \\frac{Y_i}{\\sqrt{n}}",
        "justification": "표본평균의 표준화 변환"
      },
      {
        "stepNumber": 2,
        "title": "개별 변수 Y_i의 MGF 테일러 전개",
        "explanation": "$Y_i$의 MGF $M_Y(t) = E[e^{tY}]$를 0 근방에서 2차 테일러 전개한다.",
        "typesetMath": "M_Y(t) = 1 + E[Y]t + \\frac{E[Y^2]}{2!}t^2 + o(t^2) = 1 + 0 + \\frac{t^2}{2} + o(t^2)",
        "justification": "MGF와 모멘트의 관계 ($E[Y]=0, E[Y^2]=1$)"
      },
      {
        "stepNumber": 3,
        "title": "Z_n의 적률생성함수 수립",
        "explanation": "독립 확률변수들의 합의 MGF는 각 MGF의 곱이므로 다음과 같이 표현된다.",
        "typesetMath": "M_{Z_n}(t) = \\left[ M_Y\\left(\\frac{t}{\\sqrt{n}}\\right) \\right]^n = \\left[ 1 + \\frac{t^2}{2n} + o\\left(\\frac{t^2}{n}\\right) \\right]^n",
        "justification": "독립확률변수 합의 승법적 성질"
      },
      {
        "stepNumber": 4,
        "title": "n이 무한대로 갈 때의 극한 계산",
        "explanation": "$\\lim_{n \\to \\infty} (1 + \\frac{x}{n})^n = e^x$의 극한 공식을 적용한다.",
        "typesetMath": "\\lim_{n \\to \\infty} M_{Z_n}(t) = \\lim_{n \\to \\infty} \\left[ 1 + \\frac{t^2/2}{n} \\right]^n = e^{t^2 / 2}",
        "justification": "오일러 자연상수 e의 극한 정의"
      },
      {
        "stepNumber": 5,
        "title": "연속성 정리 및 분포 수렴 판정",
        "explanation": "$e^{t^2/2}$는 표준정규분포 $\\mathcal{N}(0, 1)$의 MGF이다. 레비 연속성 정리에 의해 MGF의 수렴은 분포수렴을 보장한다.",
        "typesetMath": "M_{Z_n}(t) \\to e^{t^2/2} = M_{\\mathcal{N}(0,1)}(t) \\implies Z_n \\xrightarrow{d} \\mathcal{N}(0, 1)",
        "justification": "Lévy's Continuity Theorem"
      }
    ],
    "conclusion": "표본의 크기가 무한히 커짐에 따라 표본평균의 표준화 분포는 모집단 분포와 상관없이 표준정규분포로 수렴한다 (Q.E.D.)."
  },
  "corollariesAndApplications": [
    {
      "title": "신뢰구간 추정",
      "typesetMath": "\\bar{x} \\pm 1.96 \\frac{\\sigma}{\\sqrt{n}}",
      "description": "모평균에 대한 95% 신뢰구간 공식의 수학적 토대"
    }
  ]
}